{
  "camera_bounds": [
    0,
    0,
    1280,
    360
  ],
  "ground": [
    0,
    288,
    1280,
    72
  ],
  "id": "oliver_obstacle",
  "kind": "scene",
  "objects": {
    "brass": {
      "asset": "brass_locomotive",
      "interaction": [
        176,
        -16,
        96,
        80
      ],
      "kind": "train",
      "layer": "world",
      "position": [
        32,
        224
      ],
      "size": [
        192,
        64
      ]
    },
    "crank_handle": {
      "interaction": [
        -32,
        -16,
        80,
        64
      ],
      "kind": "handle",
      "layer": "world",
      "position": [
        1176,
        256
      ],
      "size": [
        16,
        16
      ]
    },
    "fallen_branch": {
      "interaction": [
        -16,
        -16,
        128,
        64
      ],
      "kind": "branch",
      "layer": "world",
      "position": [
        192,
        240
      ],
      "size": [
        96,
        48
      ]
    },
    "shed": {
      "kind": "shed",
      "layer": "background",
      "position": [
        1104,
        192
      ],
      "size": [
        144,
        96
      ]
    },
    "snail": {
      "interaction": [
        -24,
        -32,
        72,
        64
      ],
      "kind": "snail",
      "layer": "world",
      "position": [
        800,
        272
      ],
      "size": [
        24,
        16
      ]
    },
    "winch": {
      "interaction": [
        -32,
        -16,
        112,
        80
      ],
      "kind": "winch",
      "layer": "world",
      "position": [
        448,
        240
      ],
      "size": [
        48,
        48
      ]
    }
  },
  "puzzle": {
    "branch": "fallen_branch",
    "branch_cleared_position": [
      192,
      176
    ],
    "branch_rope_anchor": [
      48,
      8
    ],
    "handle": "crank_handle",
    "handle_recovery_spawn": "handle_recovery",
    "kind": "install_crank_handle",
    "player_spawn": "puzzle_entry",
    "return_spawn": "train_return",
    "shed": "shed",
    "snail": "snail",
    "train": "brass",
    "winch": "winch",
    "winch_rope_anchor": [
      8,
      8
    ],
    "winch_socket": [
      24,
      20
    ]
  },
  "scene_type": "oliver_puzzle",
  "schema_version": 2,
  "spawns": {
    "handle_recovery": {
      "kind": "handle_bottom_center",
      "position": [
        1184,
        288
      ]
    },
    "puzzle_entry": {
      "kind": "player_feet",
      "position": [
        280,
        288
      ]
    },
    "train_return": {
      "kind": "player_feet",
      "position": [
        280,
        288
      ]
    }
  },
  "world_bounds": [
    0,
    0,
    1280,
    360
  ]
}
